"name","quantity","description","city"
"T-shirt","125","This is a good T-shirt","New York"
"Male Pants","213","Male pants from India","New York"
"Headset","312","Logitech headset","Chicago"
"Dethatcher","67","Greenworks 14-Inch 10 Amp Corded Dethatcher 27022, Green","Boston"
"Protein Powder","678","Orgain Organic Plant Based Protein Powder, Vanilla Bean - 21g of Protein, Vegan, Low Net Carbs, Gluten Free, Lactose Free, No Sugar Added, Soy Free, Kosher, Non-GMO, 2.03 Lb","Los Angeles"
"HP Laptop","432","HP 2022 Newest Notebook Laptop, 17.3'' HD  Touchscreen, AMD Ryzen 5 5500U 6 Cores Processor, 16GB RAM, 1TB PCIe SSD, Bluetooth, Wi-Fi, Webcam, USB Type-C, Windows 11 Home, Silver","New York"